{
  "schemaVersion": "tabellio-analytics-dataset/v0.1",
  "id": "INTB-261-cross-repository-baseline",
  "observedAt": "2026-07-23T22:44:48.000Z",
  "window": {
    "since": "2026-07-01T00:00:00.000Z",
    "until": "2026-07-23T22:44:47.000Z"
  },
  "metricDefinitions": [
    {
      "id": "commitCount",
      "unit": "count",
      "definition": "Commits reachable from HEAD whose commit time falls inside the observation window.",
      "sourceSystems": [
        "git"
      ],
      "missingSemantics": "Unavailable when local Git cannot be read."
    },
    {
      "id": "validationAttemptCount",
      "unit": "count",
      "definition": "Tabellio validation results completed inside the observation window.",
      "sourceSystems": [
        "tabellio-validation"
      ],
      "missingSemantics": "Unavailable when the validation ref is absent or unreadable."
    },
    {
      "id": "validationPassRate",
      "unit": "ratio",
      "definition": "Passed validation attempts divided by all terminal validation attempts in the window.",
      "sourceSystems": [
        "tabellio-validation"
      ],
      "missingSemantics": "Unavailable when there are no terminal attempts; never reported as zero."
    },
    {
      "id": "costTelemetryCoverage",
      "unit": "ratio",
      "definition": "Validation attempts with complete required cost telemetry divided by validation attempts.",
      "sourceSystems": [
        "tabellio-validation"
      ],
      "missingSemantics": "Unavailable when there are no validation attempts."
    },
    {
      "id": "entireCheckpointCount",
      "unit": "count",
      "definition": "Distinct metadata-only Entire checkpoint sessions visible in the checkpoint ref.",
      "sourceSystems": [
        "entire"
      ],
      "missingSemantics": "Unavailable when the metadata ref is absent; transcript bodies are never read."
    },
    {
      "id": "reviewFindingCount",
      "unit": "count",
      "definition": "Review feedback records stored in Tabellio review cycles.",
      "sourceSystems": [
        "tabellio-review"
      ],
      "missingSemantics": "Unavailable when the review ref is absent."
    },
    {
      "id": "repairCount",
      "unit": "count",
      "definition": "Review fix records stored in Tabellio review cycles.",
      "sourceSystems": [
        "tabellio-review"
      ],
      "missingSemantics": "Unavailable when the review ref is absent."
    },
    {
      "id": "worktreeDirty",
      "unit": "boolean",
      "definition": "Whether Git reports tracked or untracked worktree changes at observation time.",
      "sourceSystems": [
        "git"
      ],
      "missingSemantics": "Unavailable when local Git cannot be read."
    },
    {
      "id": "evidenceCompleteness",
      "unit": "ratio",
      "definition": "Available evidence sources divided by the seven declared source systems.",
      "sourceSystems": [
        "git",
        "tabellio-validation",
        "tabellio-review",
        "entire",
        "plane",
        "github",
        "github-actions"
      ],
      "missingSemantics": "A missing source reduces completeness; it is not converted to zero-valued evidence."
    },
    {
      "id": "deliveryChangeCount",
      "unit": "count",
      "definition": "Delivery changes explicitly included in the sanitized provider snapshot.",
      "sourceSystems": [
        "plane",
        "github"
      ],
      "missingSemantics": "Unavailable when no provider snapshot is supplied."
    },
    {
      "id": "taskToPrTraceability",
      "unit": "ratio",
      "definition": "Delivery changes linked to both a Plane story and GitHub pull request divided by eligible delivery changes.",
      "sourceSystems": [
        "plane",
        "github"
      ],
      "missingSemantics": "Unavailable until compatible Plane and GitHub snapshots are supplied."
    },
    {
      "id": "leadTimeHours",
      "unit": "hours",
      "definition": "Elapsed time from work-item creation to merge for linked delivery changes.",
      "sourceSystems": [
        "plane",
        "github"
      ],
      "missingSemantics": "Unavailable until linked timestamps are supplied."
    },
    {
      "id": "cycleTimeHours",
      "unit": "hours",
      "definition": "Elapsed time from first implementation activity to merge for linked delivery changes.",
      "sourceSystems": [
        "git",
        "plane",
        "github"
      ],
      "missingSemantics": "Unavailable until linked timestamps are supplied."
    },
    {
      "id": "ciDisagreementRate",
      "unit": "ratio",
      "definition": "Candidates where hosted CI and exact-candidate validation disagree divided by compared candidates.",
      "sourceSystems": [
        "github-actions",
        "tabellio-validation"
      ],
      "missingSemantics": "Unavailable until hosted-check evidence is supplied."
    },
    {
      "id": "releaseLagHours",
      "unit": "hours",
      "definition": "Elapsed time from merge to first containing release.",
      "sourceSystems": [
        "github"
      ],
      "missingSemantics": "Unavailable until merge and release evidence is supplied."
    },
    {
      "id": "repositoryAdoption",
      "unit": "ratio",
      "definition": "Available Tabellio-native evidence sources divided by validation, review, and Entire sources.",
      "sourceSystems": [
        "tabellio-validation",
        "tabellio-review",
        "entire"
      ],
      "missingSemantics": "Measured from source availability, not commit volume or developer ranking."
    }
  ],
  "repositories": [
    {
      "id": "condere",
      "canonicalRepositoryId": "IntelIP/Condere",
      "headCommit": "4ec36ff4ba24cfd4a92c525b77a0027a001033e9",
      "headCommittedAt": "2026-07-21T10:35:01-07:00",
      "branch": "main",
      "sources": [
        {
          "id": "condere:git",
          "system": "git",
          "status": "available",
          "observedAt": "2026-07-23T22:44:48.000Z",
          "sourceVersion": "4ec36ff4ba24cfd4a92c525b77a0027a001033e9",
          "contentDigest": "83cbe98b25d5dc15ae801bbd3c0ecd1430d709d17f28e7ce55762ba96db36d5a",
          "reason": null
        },
        {
          "id": "condere:tabellio-validation",
          "system": "tabellio-validation",
          "status": "available",
          "observedAt": "2026-07-23T22:44:48.000Z",
          "sourceVersion": "658453d2eec9971f2c14284548f5f278c69432d6",
          "contentDigest": "3876ee7b79c55db3698f09bfa9dc8fcd28d92d0185d3219ddcd06397fda04cb9",
          "reason": null
        },
        {
          "id": "condere:tabellio-review",
          "system": "tabellio-review",
          "status": "unavailable",
          "observedAt": "2026-07-23T22:44:48.000Z",
          "sourceVersion": null,
          "contentDigest": null,
          "reason": "refs/tabellio/reviews is absent."
        },
        {
          "id": "condere:entire",
          "system": "entire",
          "status": "available",
          "observedAt": "2026-07-23T22:44:48.000Z",
          "sourceVersion": "9c380bcf43daf42442078dadfec1f1f1a124962e",
          "contentDigest": "6ea9aa02fe49e49696461f7dd17c6acd308fde5a324ecfb0f6e1153b9c50e481",
          "reason": null
        },
        {
          "id": "condere:plane",
          "system": "plane",
          "status": "unavailable",
          "observedAt": "2026-07-23T22:44:48.000Z",
          "sourceVersion": null,
          "contentDigest": null,
          "reason": "No sanitized provider snapshot supplied to the read-only collector."
        },
        {
          "id": "condere:github",
          "system": "github",
          "status": "unavailable",
          "observedAt": "2026-07-23T22:44:48.000Z",
          "sourceVersion": null,
          "contentDigest": null,
          "reason": "No sanitized provider snapshot supplied to the read-only collector."
        },
        {
          "id": "condere:github-actions",
          "system": "github-actions",
          "status": "unavailable",
          "observedAt": "2026-07-23T22:44:48.000Z",
          "sourceVersion": null,
          "contentDigest": null,
          "reason": "No sanitized provider snapshot supplied to the read-only collector."
        }
      ],
      "metrics": {
        "commitCount": {
          "status": "measured",
          "value": 121,
          "unit": "count",
          "sourceIds": [
            "condere:git"
          ],
          "reason": null,
          "numerator": null,
          "denominator": null
        },
        "validationAttemptCount": {
          "status": "measured",
          "value": 75,
          "unit": "count",
          "sourceIds": [
            "condere:tabellio-validation"
          ],
          "reason": null,
          "numerator": null,
          "denominator": null
        },
        "validationPassRate": {
          "status": "measured",
          "value": 0.9333333333333333,
          "unit": "ratio",
          "sourceIds": [
            "condere:tabellio-validation"
          ],
          "reason": null,
          "numerator": 70,
          "denominator": 75
        },
        "costTelemetryCoverage": {
          "status": "measured",
          "value": 0.9733333333333334,
          "unit": "ratio",
          "sourceIds": [
            "condere:tabellio-validation"
          ],
          "reason": null,
          "numerator": 73,
          "denominator": 75
        },
        "entireCheckpointCount": {
          "status": "measured",
          "value": 2,
          "unit": "count",
          "sourceIds": [
            "condere:entire"
          ],
          "reason": null,
          "numerator": null,
          "denominator": null
        },
        "reviewFindingCount": {
          "status": "unavailable",
          "value": null,
          "unit": "count",
          "sourceIds": [
            "condere:tabellio-review"
          ],
          "reason": "refs/tabellio/reviews is absent.",
          "numerator": null,